{"$schema":"https://json-schema.org/draft/2020-12/schema","$id":"urn:gonow:commands-v1","type":"object","additionalProperties":false,"required":["schema_version","task_id","commands"],"properties":{"schema_version":{"const":"1.0"},"task_id":{"type":"string","pattern":"^TASK-"},"source_native_receipt_sha256":{"type":"string","pattern":"^[a-f0-9]{64}$"},"commands":{"type":"array","items":{"type":"object","required":["command_id","mode","executable","arguments","expected_exit_codes","actual_exit_code","started_at","completed_at","redacted"],"properties":{"command_id":{"type":"string"},"mode":{"type":"string"},"executable":{"type":"string"},"arguments":{"type":"array","items":{"type":"string"}},"expected_exit_codes":{"type":"array","items":{"type":"integer"}},"actual_exit_code":{"type":"integer"},"started_at":{"type":"string"},"completed_at":{"type":"string"},"redacted":{"type":"boolean"}},"additionalProperties":false}}}}
