{"schema_version":"1.0","task_id":"TASK-BOOT-002","source_native_receipt_sha256":"2294a923aaa19008e86cd5422ff15d7a361157bf2c16b3ac46c358fa8021ce5c","commands":[{"command_id":"chapter-1-native-002","mode":"native","executable":"powershell-native","arguments":["execplan.md Chapter 1 BOOT-002 block"],"expected_exit_codes":[0],"actual_exit_code":0,"started_at":"2026-07-31T17:04:42.0238083+08:00","completed_at":"2026-07-31T17:04:42.0238083+08:00","redacted":true}]}